candidate_id,candidate,date,race_id,race_name,candidate_party,votes,is_winner,election_type,is_uncontested,number_of_seats_in_election,total_number_of_ballots_in_race
289870,Kelsey Winter,2025-08-05,243168,MI Milan Library Director Board At-large,Nonpartisan,488,Y,Primary,false,4,1602
424174,Patrick Hoang,2025-11-04,410246,TX Freedom Trail Municipal Utility District Board At-large (Liberty County),Nonpartisan,uncontested,Y,General Election,true,5,uncontested
248880,Derek McDaniel,2025-04-01,208910,IL Naperville City Council At-large,Nonpartisan,8156,N,General Election,false,4,85405
248715,Michelle Powell-johnson,2025-04-01,208794,IL Monee Village Clerk,Independent,uncontested,Y,General Election,true,1,uncontested
251388,Robert Onan,2025-04-01,210327,IL Winthrop Harbor Village Trustee Board At-large,Independent,543,N,General Election,false,3,3529
239744,Evan Boose,2025-04-01,204628,IL North Clay Park District Commissioner Board At-large Special,Nonpartisan,uncontested,Y,Special Election General,true,2,uncontested
291615,Daren Watts,2025-11-04,369390,UT Holladay City Mayor,Nonpartisan,4219,N,General Election,false,1,9820
288520,Cody St.Louis,2025-06-10,241786,ME Buxton Budget Committee Board At-large,Nonpartisan,255,N,General Election,false,3,1331
241637,Sarah Brezinski,2025-04-01,205604,"IL Gavin School District 37, At-large",Nonpartisan,uncontested,Y,General Election,true,4,uncontested
291459,Alexis Valdez,2025-08-12,243726,UT East Carbon City Council,Nonpartisan,38,N,Primary,false,2,391
274129,Dylan Hedrick,2025-06-07,241727,TX Garland Mayor,Nonpartisan,4009,Y,Runoff,false,1,7756
72456,Joseph Mitchell,2025-11-04,407938,OH Hopewell Township Trustee Board At-large (Licking County),Nonpartisan,uncontested,Y,General Election,true,2,uncontested
243365,Rick Casey,2025-04-01,206081,"IL Collinsville Community Unit School District 10, At-large",Nonpartisan,1952,N,General Election,false,3,15525
429046,Kathy Janss,2025-11-04,413791,IA Keystone City Council At-large,Nonpartisan,56,Y,General Election,false,3,221
246519,Jeffrey Sargent,2025-04-01,207565,IL Elmwood Park Village Trustee Board At-large,Other,uncontested,Y,General Election,true,3,uncontested
248573,Ethan Myers,2025-05-03,223292,TX Sedona Municipal Utility Board At-large 1,Nonpartisan,uncontested,Y,General Election,true,5,uncontested
260031,Cindy Rafkind,2025-04-01,215334,IL Coral Township Trustee Board At-large (McHenry County),Independent,296,Y,General Election,false,4,1342
122561,Amanda White,2025-11-04,368601,KS Goddard City Council,Nonpartisan,288,Y,General Election,false,3,1027
128748,Travis Smith,2025-04-01,194207,OK Town of Fletcher Board of Trustees,Nonpartisan,45,N,General Election,false,2,189
425459,Yyacheeko la Marianne Veal,2025-11-04,411844,GA Gordon City Council At-large,Nonpartisan,76,N,General Election,false,3,1926
221517,Paul Cieslewicz,2025-04-01,193834,WI Buena Vista Town Board Chairperson,Nonpartisan,uncontested,Y,General Election,true,1,uncontested
217245,Tim Hallquist,2025-04-01,187829,WI Hartland Village Trustee,Nonpartisan,2280,Y,General Election,false,3,7638
274245,Don Powell,2025-05-03,224607,TX Amarillo Independent School District,Nonpartisan,13388,Y,General Election,false,4,43135
397657,Willie Burnette,2025-11-04,410888,NC Mayor of Godwin,Nonpartisan,uncontested,Y,General Election,true,1,uncontested
222417,Scott Deutscher,2025-04-01,192165,WI Wheaton Town Clerk (Chippewa County),Nonpartisan,uncontested,Y,General Election,true,1,uncontested
242734,Jason Bastian,2025-04-01,205914,"IL Glenbard Township High School District 87, At-large",Nonpartisan,11861,Y,General Election,false,4,49603
240134,Suzanne Austin,2025-04-01,204814,IL Clarendon Hills Park District Commissioner Board At-large,Nonpartisan,uncontested,Y,General Election,true,3,uncontested
273985,Mark Loffgren,2025-05-03,224494,TX Victoria City Council 6,Nonpartisan,uncontested,Y,General Election,true,1,uncontested
241485,Aritha Windom-Harvey,2025-04-01,205568,"IL Dolton School District 148, At-large",Nonpartisan,766,Y,General Election,false,4,6419
433581,Ward Hamilton,2025-11-04,418581,MA Melrose Councilor Ward Four,Nonpartisan,477,N,General Election,false,1,1687
384671,David Amanullah,2025-11-04,368934,NJ Woodland Park Borough Board of Education,Nonpartisan,1745,Y,General Election,false,3,8768
247337,Shannon Sweeney,2025-04-01,208018,IL Herscher Village President,Independent,uncontested,Y,General Election,true,1,uncontested
378093,Mark Posthuma,2025-11-04,364986,WA Cheney City Council Position 3,Nonpartisan,uncontested,Y,General Election,true,1,uncontested
242263,Anna Morgen,2025-04-01,205783,"IL River Grove School District 85-5, At-large",Nonpartisan,331,Y,General Election,false,4,1414
217218,Brett Nelson,2025-04-01,187816,WI Gresham Village Trustee,Nonpartisan,uncontested,Y,General Election,true,3,uncontested
218542,Gary Lazarz,2025-04-01,188787,WI Anson Town Board Chairperson (Chippewa County),Nonpartisan,uncontested,Y,General Election,true,1,uncontested
258495,Chuck Buyck,2025-04-01,214440,IL Hanna Township Clerk (Henry County),Independent,uncontested,Y,General Election,true,1,uncontested
261270,Adam Browder,2025-04-01,216015,IL Earl Township Supervisor (LaSalle County),Independent,uncontested,Y,General Election,true,1,uncontested
286133,Mark Pacheco,2025-05-20,240331,"OR Columbia 9-1-1 Communications Dist. 9‑1‑1 Communications Director, Zone 3",Nonpartisan,uncontested,Y,General Election,true,1,uncontested
389284,Jeffrey Onnen,2025-11-04,385963,ME Saco City Council Ward 4,Nonpartisan,696,Y,General Election,false,1,1206
286169,Megan Ramey,2025-05-20,239973,OR Hood River County Transportation District Director,Nonpartisan,uncontested,Y,General Election,true,4,uncontested
241391,Rodney Rossow,2025-04-01,205538,"IL Colona School District 190, At-large",Nonpartisan,uncontested,Y,General Election,true,4,uncontested
246223,Margaret Chlebek,2025-04-01,207392,IL Des Plaines City Council Ward 1,Independent,353,Y,General Election,false,1,694
411097,Alivia Stamp,2025-11-04,406438,OH Meyers Lake Village Council At-large,Nonpartisan,176,Y,General Election,false,4,843
410621,Sam Artino,2025-11-04,406221,OH Huron City Council At-large,Nonpartisan,uncontested,Y,General Election,true,4,uncontested
254629,Justin Gough,2025-04-01,212185,IL Caseyville Township Clerk (St. Clair County),Other,uncontested,Y,General Election,true,1,uncontested
273697,Val Meixner,2025-05-03,224351,TX Mayor of Ransom Canyon,Nonpartisan,uncontested,Y,General Election,true,1,uncontested
415026,Tom Peck,2025-11-04,408235,OH Monroe Township Trustee Board At-large (Clermont County),Nonpartisan,uncontested,Y,General Election,true,2,uncontested
272573,Misty Collier,2025-05-03,223753,TX Mayor of Amarillo,Nonpartisan,562,N,General Election,false,1,16709
216152,Heidi Brill,2025-04-01,193188,WI New Holstein School Board,Nonpartisan,uncontested,Y,General Election,true,3,uncontested
248928,Sherry Armoska,2025-04-01,208935,IL Nelson Village Trustee Board At-large,Independent,22,Y,General Election,false,3,85
289961,Jim Hart,2025-08-05,243185,MI Westland City Council At-large,Nonpartisan,2357,Y,Primary,false,8,27509
16649,Yes,2025-11-04,387862,NY Marcellus Fire Department Service Awards Program Monetary Increase Ballot Question 1,Nonpartisan,1423,Y,General Election,false,1,1743
409129,Julie MacLaine,2025-11-04,405521,"OH West Muskingum Local School District, At large",Nonpartisan,uncontested,Y,General Election,true,3,uncontested
442155,Harry Good,2025-11-04,419966,SC Hickory Grove Town Council At-large,Nonpartisan,uncontested,Y,General Election,true,4,uncontested
240382,Richard Guzman,2025-04-01,204969,IL Waubonsee Community College District 516 Trustee Board At-large Special,Nonpartisan,uncontested,Y,Special Election General,true,1,uncontested
384165,Dorothy Watson-Nichols,2025-11-04,368777,NJ Oradell Board of Education,Nonpartisan,1622,Y,General Election,false,3,6724
405683,Ryan Merrill,2025-11-04,410645,NC Belville Town Council,Nonpartisan,uncontested,Y,General Election,true,2,uncontested
241360,Derek Harlan,2025-04-01,205530,"IL Centralia School District 135, At-large",Nonpartisan,uncontested,Y,General Election,true,4,uncontested
220388,Bob Reed,2025-04-01,193754,WI Rock Town Constable,Nonpartisan,uncontested,Y,General Election,true,1,uncontested
139701,Travis Owens,2025-11-04,410311,"TX Mount Enterprise Independent School District, At-large",Nonpartisan,125,Y,General Election,false,3,461
383428,Shawna Will,2025-11-04,368533,KS Halstead City Council,Nonpartisan,274,Y,General Election,false,3,1635
223976,Jonathan Hallmark,2025-04-01,194271,OK Town of Langston City Trustee Board Office 2,Nonpartisan,4,N,General Election,false,1,91
325713,Nathan Honeycutt,2025-08-26,274355,TN Knoxville City Council 2,Nonpartisan,uncontested,Y,Primary,true,2,uncontested
273385,Crystal Mancilla,2025-05-03,224183,TX Mayor of Liberty Hill,Nonpartisan,196,Y,General Election,false,1,333
271078,Justin Griffin,2025-04-12,223043,ME North Berwick Cemetery District Board,Nonpartisan,uncontested,Y,General Election,true,1,uncontested
253216,Kevin Poust,2025-04-01,211373,IL Virgil Township Trustee Board At-large (Kane County),Nonpartisan,249,Y,General Election,false,4,1213
331120,David Steele,2025-11-04,413487,IA Exline City Council At-large,Nonpartisan,uncontested,Y,General Election,true,5,uncontested
412510,Randy Brewer,2025-11-04,407105,OH West Union Village Council At-large,Nonpartisan,uncontested,Y,General Election,true,4,uncontested
217058,Jim Steebs,2025-04-01,187707,WI Eland Village Trustee,Nonpartisan,uncontested,Y,General Election,true,2,uncontested
260282,Jacques Wesson,2025-04-01,215475,IL Victor Township Trustee Board At-large (DeKalb County),Independent,uncontested,Y,General Election,true,4,uncontested
410382,Donald Banas,2025-11-04,406118,OH Glenwillow Village Council Ward 3,Nonpartisan,uncontested,Y,General Election,true,2,uncontested
383078,Diane Shirley,2025-11-04,368436,KS Muddy Creek Drainage District Director,Nonpartisan,15,Y,General Election,false,3,50
220081,Tadd Meier,2025-04-01,190142,WI Wayne Town Board Supervisor 2 (Lafayette County),Nonpartisan,uncontested,Y,General Election,true,1,uncontested
142729,John Pettis Jr.,2025-04-01,194046,OK Oklahoma City Council Ward 7,Nonpartisan,1400,N,Runoff,false,1,3949
414504,Shad Kendall,2025-11-04,408011,OH Weston Township Trustee Board At-large (Wood County),Nonpartisan,uncontested,Y,General Election,true,2,uncontested
240883,Phillip Dunn,2025-04-01,206055,IL Carrier Mills-Stonefort Community Unit School District 2 At-large,Nonpartisan,uncontested,Y,General Election,true,3,uncontested
218589,Michael Paternoster,2025-04-01,188826,WI Pence Town Board Chairperson (Iron County),Nonpartisan,uncontested,Y,General Election,true,1,uncontested
381756,Alfred Black,2025-11-04,367907,NM Abeytas-Sabinal Special Zoning District Board At-large,Nonpartisan,uncontested,Y,General Election,true,5,uncontested
240684,Richard Stasewich,2025-04-01,205155,IL Cary Park District Commissioner Board At-large,Nonpartisan,791,N,General Election,false,2,4215
423460,Curt Strickland,2025-11-04,411227,NC Roanoke Rapids City Council 1,Nonpartisan,uncontested,Y,General Election,true,1,uncontested
223126,Kevin Mathison,2025-04-01,192783,WI Coon Town Board Supervisor 1 (Vernon County),Nonpartisan,uncontested,Y,General Election,true,1,uncontested
258778,Bill Weidling,2025-04-01,214616,IL Wilmington Township Highway Commissioner (Will County),Republican,673,Y,General Election,false,1,1018
240165,Alexander Dugaw,2025-04-01,204831,IL Lombard Park District Commissioner Board At-large,Nonpartisan,2307,N,General Election,false,3,12807
424639,Kristofer Young,2025-11-04,410469,TX Miles City Alderman At-large,Nonpartisan,23,N,General Election,false,2,145
413817,John Ishee,2025-11-04,407706,OH Russell Township Trustee Board At-large (Geauga County),Nonpartisan,602,N,General Election,false,2,3529
216853,Kevin Curley,2025-04-01,187554,WI Cedarburg Common Council 4,Nonpartisan,uncontested,Y,General Election,true,1,uncontested
429629,Keith Huebner,2025-11-04,414095,IA Mayor of Mount Vernon,Nonpartisan,197,N,General Election,false,1,1218
112291,Eric Meyer,2025-11-04,386478,MN Falcon Heights City Council At-large,Nonpartisan,94,N,General Election,false,2,2696
286595,Todd Breeding,2025-05-20,240656,"OR Greensprings RFPD Director, Position 3",Nonpartisan,uncontested,Y,General Election,true,1,uncontested
398214,Sissy Stegall,2025-11-04,411192,NC Polkton Town Council,Nonpartisan,uncontested,Y,General Election,true,5,uncontested
389850,Andrea Wagner,2025-11-04,386220,SC Mayor of Liberty,Nonpartisan,518,Y,General Election,false,1,605
252890,Wilbur Stamberger,2025-04-01,211184,IL Clarion Township Trustee Board At-large (Bureau County),Independent,uncontested,Y,General Election,true,4,uncontested
258097,Chriss Smith,2025-04-01,214203,IL Western Township Clerk (Henry County),Independent,uncontested,Y,General Election,true,1,uncontested
243110,Jenny Moore,2025-04-01,206006,"IL Arthur Community Unit School District 305, At-large",Nonpartisan,783,Y,General Election,false,3,2836
410181,Christy Resnik,2025-11-04,406007,OH Fairfax Village Council At-large,Nonpartisan,229,Y,General Election,false,4,1076
272205,Melinda Barajas,2025-05-03,223578,TX Mathis Independent School District Place 2,Nonpartisan,uncontested,Y,General Election,true,1,uncontested
275815,Jeff Thompson,2025-11-04,407208,"OH Madison Local School District (Lake County), At-large",Nonpartisan,1369,N,General Election,false,3,8846
408996,Wendy Doyle,2025-11-04,405473,"OH United Local School District, At-large",Nonpartisan,925,Y,General Election,false,3,3484
409564,Peyton Schafer,2025-11-04,405710,OH Bloomdale Village Council At-large,Nonpartisan,18,N,General Election,false,4,399
241168,Tamar Lasko,2025-04-01,205470,"IL Antioch Community Consolidated School District 34, At-large",Nonpartisan,1257,N,General Election,false,4,8194
378748,Paul Dutton,2025-11-04,365589,WA Renton City Council Position 6,Nonpartisan,5789,N,General Election,false,1,18258
411148,Becky Abbey,2025-11-04,406461,OH Millbury Village Council At-large,Nonpartisan,uncontested,Y,General Election,true,4,uncontested
271227,Mark Calzolaio,2025-04-01,223128,MA Milford Town Constable,Nonpartisan,559,N,General Election,false,1,3296
241714,Dean Barnett,2025-04-01,205631,"IL Hazel Crest School District 152-5, At-large",Nonpartisan,uncontested,Y,General Election,true,4,uncontested
216501,Chris Sorenson,2025-04-01,193256,WI Wild Rose School Board Area VI,Nonpartisan,uncontested,Y,General Election,true,1,uncontested
426452,Beth Danowsky,2025-11-04,412392,IA Indian Hills Community College District (IHCC) Director 1,Nonpartisan,uncontested,Y,General Election,true,1,uncontested
422659,Joe Lloyd Jr.,2025-11-04,410715,NC Mayor of Carrboro,Nonpartisan,94,N,General Election,false,1,2882
430634,Kelly Martin,2025-11-04,414648,IA Waterloo City Council At-large,Nonpartisan,5609,Y,General Election,false,1,10170
143890,Christopher Weber,2025-11-04,410597,NC Mayor of Aberdeen,Nonpartisan,70,N,General Election,false,1,719
413527,Greg Maraczi,2025-11-04,407566,OH Bristol Township Trustee Board At-large (Trumbull County),Nonpartisan,197,N,General Election,false,2,711
272664,William Depew,2025-05-03,223801,TX Blanco City Council At-large,Nonpartisan,56,N,General Election,false,2,520
379691,Joe Koehler,2025-11-04,366508,WA Pierce County Fire  Commissioner Board Position 2 23,Nonpartisan,uncontested,Y,General Election,true,1,uncontested
410504,Christopher Zehnder,2025-11-04,406169,OH Hartford Village Council At-large,Nonpartisan,uncontested,Y,General Election,true,4,uncontested
290571,Robert Angrisano,2025-08-05,243374,WA King County Public Hospital  Commissioner Board Position 2 4,Nonpartisan,3658,Y,Primary,false,2,9333
384547,Emily Calistri,2025-11-04,368906,NJ Bridgewater-Raritan Board of Education,Nonpartisan,6150,N,General Election,false,3,41424
64934,Thomas Johnson,2025-11-04,407878,OH Brimfield Township Trustee Board At-large (Portage County),Nonpartisan,224,N,General Election,false,2,4150
408360,Tonya Mabry,2025-11-04,405251,"OH Marysville Exempted Village School District, At-large",Nonpartisan,3167,Y,General Election,false,3,13826
273905,Rick Miller,2025-11-04,406138,OH Green City Council Ward 3,Nonpartisan,650,N,General Election,false,1,1327
241155,Harry Tannehill,2025-04-01,205467,"IL Alsip-Hazlgrn-Oaklwn School District 126, At-large",Nonpartisan,554,Y,General Election,false,4,3034
274194,Lawson Alaniz-Picasso,2025-05-03,224588,TX San Antonio City Council 6,Nonpartisan,714,N,General Election,false,1,8411
261408,David Long,2025-04-01,216099,IL Miller Township Trustee Board At-large (LaSalle County),Independent,uncontested,Y,General Election,true,4,uncontested
244187,Jason Dirks,2025-04-01,206319,"IL Paxton-Buckley-Loda Community Unit School District 10, At-large",Nonpartisan,621,N,General Election,false,4,3743
259963,Micah McKinney,2025-04-01,215296,IL Pin Oak Township Trustee Board At-large (Madison County),Independent,343,Y,General Election,false,4,1651
73173,Brian Jones,2025-11-04,405053,"OH Columbus Grove Local School District, At-large",Nonpartisan,uncontested,Y,General Election,true,2,uncontested
261486,Joshua Alden,2025-04-01,216136,IL Osage Township Supervisor (LaSalle County),Independent,uncontested,Y,General Election,true,1,uncontested
425114,Clay Vaughan,2025-11-04,411647,GA Byromville City Council At-large Conshelloah Clayton's seat,Nonpartisan,37,Y,General Election,false,1,68
143626,Georgette Gantner,2025-03-04,110729,CA Mayor of Redondo Beach,Nonpartisan,0,N,General Election RCV,false,1,9981
286212,Mikeala Bradford,2025-05-20,240391,OR School District 4 – Position 1,Nonpartisan,uncontested,Y,General Election,true,1,uncontested
252510,Tim Muehlenpfort,2025-04-01,210965,IL Wall Township Supervisor (Ford County),Independent,uncontested,Y,General Election,true,1,uncontested
291550,Jennilee Shakespear,2025-11-04,369346,UT Henrieville Town Council,Nonpartisan,64,Y,General Election,false,2,188
248821,Tyler Johnson,2025-04-01,208871,IL Mount Olive City Council Ward 4,Independent,10,N,General Election,false,1,156
59921,Fred Johnson,2025-02-11,110054,OK Wapanucka Public School Board Office 5,Nonpartisan,44,N,Primary,false,1,139
252606,Michael Chambers,2025-04-01,211024,IL Brookside Township Supervisor (Clinton County),Independent,uncontested,Y,General Election,true,1,uncontested
143209,Lisa Gomez,2025-02-25,110380,IL Berwyn City Treasurer,Nonpartisan,3076,N,Primary,false,1,6572
246062,Henry Feldmann,2025-04-01,207299,IL Crossville Village President,Independent,55,N,General Election,false,1,223
243969,John Hedges III,2025-04-01,206255,IL Mattoon Community Unit School District 2 school board At-large,Nonpartisan,1550,Y,General Election,false,3,9549
251357,Randallee Wallace,2025-04-01,210312,IL Windsor City Commission At-large,Nonpartisan,uncontested,Y,General Election,true,4,uncontested
410059,Brian Yarnell,2025-11-04,405955,OH Deshler Village Public Affairs Trustee Board At-large,Nonpartisan,uncontested,Y,General Election,true,1,uncontested
246207,Jennifer La Mell Goldstone,2025-04-01,207384,IL Deerfield Village Trustee Board At-large,Other,uncontested,Y,General Election,true,3,uncontested
385413,Stephen Henry,2025-11-04,369251,NJ Point Pleasant Borough Board of Education,Nonpartisan,3962,Y,General Election,false,2,10539
256646,Jeff Winterland,2025-04-01,213364,IL Pine Rock Township Highway Commissioner (Ogle County),Independent,uncontested,Y,General Election,true,1,uncontested
391557,Gloria Walton,2025-11-04,386869,NJ Jersey City Council Ward F,Nonpartisan,2170,N,General Election,false,1,8943
242408,Kwynn Rury,2025-04-01,205821,"IL South Wilmington Community Consolidated School District 74, At-large",Nonpartisan,136,Y,General Election,false,3,539
413457,Jack Webb,2025-11-04,407534,OH Franklin Township Trustee Board At-large (Jackson County),Nonpartisan,238,Y,General Election,false,2,628
270988,John Suchanec,2025-04-08,223032,DE City of Newark City Council 1,Nonpartisan,460,Y,General Election,false,1,816
379564,Thomas Johnston,2025-11-04,366378,WA King County Fire  Commissioner Board Position 2 34,Nonpartisan,uncontested,Y,General Election,true,1,uncontested
242038,David Rush,2025-04-01,205720,"IL New Lenox School District 122, At-large",Nonpartisan,uncontested,Y,General Election,true,4,uncontested
439948,Yesenia Alfaro,2025-11-04,418488,MA Chelsea Councilor At Large,Nonpartisan,631,N,General Election,false,3,4491
285299,Barbara Ferrando,2025-05-20,239575,OR Christmas Valley Park & Rec District – Position 3,Nonpartisan,29,N,General Election,false,1,122
376935,Courtney Smith,2025-11-04,363995,GA Atlanta City Council 2,Nonpartisan,2163,N,General Election,false,1,10531
216871,Robbie Seipel,2025-04-01,187567,WI Chilton Alderperson 3,Nonpartisan,uncontested,Y,General Election,true,1,uncontested
382582,Gabriel Maestas,2025-11-04,368263,NM Mayor of Wagon Mound,Nonpartisan,23,N,General Election,false,1,110
259614,Tim Clay,2025-04-01,215106,IL Dakota Township Supervisor (Stephenson County),Independent,uncontested,Y,General Election,true,1,uncontested
424556,Frank Hosea,2025-11-04,410419,TX Horseshoe Bay City Council At-large,Nonpartisan,uncontested,Y,General Election,true,2,uncontested
222309,Kim Simac,2025-04-01,192061,WI Lincoln Town Board Supervisor 1 (Vilas County),Nonpartisan,uncontested,Y,General Election,true,1,uncontested
325089,Jacquese Gary,2025-08-26,273994,AL Pleasant Grove City Council,Nonpartisan,1299,Y,General Election,false,5,12977
291251,J. Ben Blank,2025-08-12,243685,UT Alpine City Council,Nonpartisan,53,N,Primary,false,4,3864
249016,Dennis Kibler,2025-04-01,208982,IL Mayor of Newman,Independent,uncontested,Y,General Election,true,1,uncontested
246599,Bethany Wunderlich,2025-04-01,207613,IL Evansville Village Clerk,Independent,uncontested,Y,General Election,true,1,uncontested
290197,Cobi Clark,2025-08-05,243256,WA Auburn City Council Position 6,Nonpartisan,2841,Y,Primary,false,2,9865
414509,Ross Shepard,2025-11-04,408012,OH Dixon Township Trustee Board At-large (Preble County),Nonpartisan,44,N,General Election,false,2,292
273062,Dave Richardson,2025-05-03,224016,TX Georgetown City Council 4,Nonpartisan,298,N,General Election,false,1,872
416226,Morgen Mogus,2025-11-04,408801,PA School Director Karns City School District,Libertarian,869,N,General Election,false,4,8915
409521,Jason Call,2025-11-04,405697,OH Berkey Village Council At-large Special,Nonpartisan,41,N,Special Election General,false,1,94
137016,Regina Ross,2025-08-05,243451,MI Detroit City Council 7,Nonpartisan,2470,N,Primary,false,2,9846
256336,Mark Goodwin,2025-04-01,213193,IL Scales Mound Township Highway Commissioner (Jo Daviess County),Independent,uncontested,Y,General Election,true,1,uncontested
245192,Annie Delgado,2025-04-01,206770,IL Bellwood Village Trustee Board At-large,Other,1869,Y,General Election,false,3,8214
388510,Virgil Nelson,2025-11-04,385377,MT Opheim Town Council Ward 2,Nonpartisan,uncontested,Y,General Election,true,1,uncontested
243990,Samantha Murray,2025-04-01,206262,"IL Meridian Community Unit School District 15 school board, At-large",Nonpartisan,291,Y,General Election,false,3,1576
251177,Mary Bade,2025-04-01,210221,IL Mayor of Wenona,Independent,197,Y,General Election,false,1,354
217759,Dennis Burtness,2025-04-01,188194,WI Orfordville Village President,Nonpartisan,uncontested,Y,General Election,true,1,uncontested
409320,Thad Dempster,2025-11-04,405594,OH Arlington Village Council At-large,Nonpartisan,uncontested,Y,General Election,true,4,uncontested
256871,Kevin Schnetzler,2025-04-01,213491,IL Sycamore Township Assessor (DeKalb County),Independent,uncontested,Y,General Election,true,1,uncontested
251465,Dawn Cazadd,2025-04-01,210369,IL Xenia Village Clerk,People's Party,uncontested,Y,General Election,true,1,uncontested
239847,Jamal Liddell,2025-04-01,204685,IL Golf Maine Park District Commissioner Board At-large,Nonpartisan,uncontested,Y,General Election,true,1,uncontested
288840,Ronald L. Hines,2025-06-03,242070,"MS Brookhaven Alderman, At-Large",Nonpartisan,1810,Y,General Election,false,1,3378
415722,Gary Landis,2025-11-04,408549,OH Rochester Township Trustee Board At-large (Lorain County),Nonpartisan,uncontested,Y,General Election,true,2,uncontested
436581,Thomas St. Louis,2025-11-04,417179,CT Lyme First Selectman,Republican,474,N,General Election,false,1,1184
223447,Valarie Hill,2025-04-01,193068,WI Milwaukee Municipal Judge,Nonpartisan,uncontested,Y,General Election,true,1,uncontested
415964,W. Kevin Spiker,2025-11-04,408654,OH Madison Township Trustee Board At-large (Muskingum County),Nonpartisan,uncontested,Y,General Election,true,2,uncontested
290135,Jim Kallio,2025-11-04,367054,WA Sedro-Woolley School District school board 1,Nonpartisan,3914,Y,General Election,false,1,7032
381841,Alena Brandenberger,2025-11-04,367944,NM Corona Public Schools school board At-large,Nonpartisan,uncontested,Y,General Election,true,3,uncontested
389265,Lucy Richard,2025-11-04,385954,ME Maine School Administrative District 1 Section 12,Nonpartisan,uncontested,Y,General Election,true,1,uncontested
216624,Dan Mrotek,2025-04-01,187407,WI Arpin Village Trustee,Nonpartisan,uncontested,Y,General Election,true,2,uncontested
259583,Judith Gurney,2025-04-01,215088,IL Rockton Township Clerk (Winnebago County),Independent,uncontested,Y,General Election,true,1,uncontested
424669,Chrystal Garcia,2025-11-04,410484,TX Northlake Fresh Water Supply  Board At-large (Denton County) 1,Nonpartisan,uncontested,Y,General Election,true,5,uncontested
383180,Donald Westhoff,2025-11-04,368467,KS Alma City Council,Nonpartisan,53,N,General Election,false,2,210
426524,Chet Meneely,2025-11-04,412439,"IA Atlantic Community School District, At-large",Nonpartisan,1091,Y,General Election,false,2,3761
288051,Bill Dugger,2025-06-03,241499,MS Alderman Ward 1 (Batesville),Independent,133,N,General Election,false,1,528
